Title,Job Description,Employer,Location,URL,Minimum Salary,Maximum Salary
Python Developer,"Job Description Job Description 6 months contract with the client REMOTE work-from-home Mid-Level Software Engineer & Candidates must have: Python for API Microservices, AWS, Unit testing, DynamoDB (NoSQL), Kinesis, IOT, MQTT protocols, ReactJS Or VUEJS & 1-2 years of experience in building and maintaining microservice architectures, cloud-based applications, and data-intensive systems. Familiarity with unit testing, infrastructure as code, and a strong commitment to hitting the ground running.…",Cyborgwave,"Los Angeles, Los Angeles County",https://www.adzuna.com/land/ad/4911441808?se=9FH7TLSj7xGdenp_bhtGHQ&utm_medium=api&utm_source=4772744a&v=6D4C25730583A46EC3B522E9E88EAA1DFF6B9E6A,101837.11,101837.11
AWS Python Developer,"Job Description Job Description Job Position: AWS Python Developer Position Type: C2C or W2 Location: Plano, TX (Hybrid) Client: Banking We are seeking a highly skilled Senior Python Developer with significant experience in AWS, vulnerability remediation, and database management. The ideal candidate will be responsible for developing scalable solutions, managing AWS resources, ensuring security compliance, and optimizing database performance. This role requires a deep understanding of Python, A…",Cyborgwave,"Los Angeles, Los Angeles County",https://www.adzuna.com/land/ad/4940309939?se=9FH7TLSj7xGdenp_bhtGHQ&utm_medium=api&utm_source=4772744a&v=01A6E15FB9747C252DFEE11126EC8AF81174648B,122505.0,122505
Senior Python Developer,"Job Description Job Description Job description We are looking for a seasoned Senior Python developer with experience in AWS platform and services and implementing pre-trading systems. It is a Hybrid role at least two days a week in is San Francisco, California office. Requirements of Senior Python developer with experience in AWS platform and services and implementing pre-trading systems : Experience of Senior Python developer with experience in AWS platform and services and implementing pre-t…",Mutual Funds Asset Management,"San Francisco, California",https://www.adzuna.com/land/ad/4939660834?se=9FH7TLSj7xGdenp_bhtGHQ&utm_medium=api&utm_source=4772744a&v=772B85C2AF4CEF6DD07C17A9D8C82CAC24A3F638,128377.52,128377.52
Senior/Principal Python Developer,"Job Description Job Description Hi, Only W2 on third party consultant This is Abhishek Kumar here from SIBITALENT . I am trying to reach you regarding the below job role, please have a look at the job description, and please contact me at 972-737-8724. Title: - Senior/Principal Python Developer Location: Boston, MA or San Francisco (Hybrid) Duration: - 8 months Client:- Natixis Visa: - NO H1/CPT Interview Process :- Phone/Web Experience :: 12 Years Note :: No third party candidate for this role…",Sibitalent,"San Francisco, California",https://www.adzuna.com/land/ad/4933285421?se=9FH7TLSj7xGdenp_bhtGHQ&utm_medium=api&utm_source=4772744a&v=8A6B6C0645694AAADDD344B7F7A0B24273E9AD63,107415.76,107415.76
Python Backend developer,"Job Description Job Description Python Backend developer Work Location: San Ramon, CA (Needed only Locals 30-40 miles) Work Mode : Day 1 onsite. Mode of Interview: F2F only JD: 10-12 years or experience Hands-on experience in Python Scripts Good Analytical and problem-solving abilities Experience in Agile/Scrum based project executions Nice to Have Knowledge on Cloud App services, Load Balancer, Application Gateway Hand on with Cloud services preferably Azure Experience in NoSQL Database and in…",Marvel Infotech,"San Ramon, Contra Costa County",https://www.adzuna.com/land/ad/4939676534?se=9FH7TLSj7xGdenp_bhtGHQ&utm_medium=api&utm_source=4772744a&v=95ACEC5BF3CC96EB19BC0B2DBA1CE0159F11E09F,57700.34,57700.34
Python Developer,"If you find this opportunity aligns with your career goals and interests, we kindly request that you send us your documents to ajandekarthethinkbeyond.com Job Title: AMSEP233-Software Engineer - Python Client Name: Galileo Office location: US , (Remote) Duration: 6 months contract to start with the great possibility of extension Job Description Senior developers We are looking for a Software Engineer to advance financial inclusion and digital transformation by adapting our platform to comply wi…",S M Software Solutions Inc,"Mountain View, Santa Clara County",https://www.adzuna.com/details/4913352738?utm_medium=api&utm_source=4772744a,102410.16,102410.16
Python Developer,"Foxley Talent are currently searching for a fully remote Python Developer with experience in Django to join our client for a key role in their product team. This position will be working with a leading digital innovation company that provides tools to help online creators produce and share their latest content. The main platform is used to share content with billions of people worldwide. PLEASE BE AWARE, this company's main product serves the adult entertainment industry. The successful Python …",Foxley Talent Limited,"California, US",https://www.adzuna.com/details/4928939405?utm_medium=api&utm_source=4772744a,143181.47,143181.47
Python Developer,"Title : Python Developer Required Location : Oakland CA ( Hybrid - 3/days onsite in Oakland CA office) – Locals only Duration : 12 months Must have Investment Systems exp. Must Haves: Investment systems knowledge (trading, securities, etc) Ability to effectively communicate with portfolio managers, work closely with them to rapidly build solutions Python strongly preferred Knowledge of AWS services like lambdas, ECS and AWS infrastructure GitHub. Preferred : AWS certification Knowledge of inves…","V-Soft Consulting Group, Inc.","Oakland, Alameda County",https://www.adzuna.com/details/4916510684?utm_medium=api&utm_source=4772744a,95568.45,95568.45
Python Developer,"Role: Python Developer Full Time Remote 100 % Description: Must Have Technical/Functional Skills 10 years of software engineering experience with 5 years of experience in Python Experience in Django & Nginx Exposure to AWS Gov cloud, cloud security is an advantage. Exposure to fed ramp & IL5 compliance environments is an advantage Diverse Lynx LLC is an Equal Employment Opportunity employer. All qualified applicants will receive due consideration for employment without any discrimination. All a…",Diverse Lynx,"Campbell, Santa Clara County",https://www.adzuna.com/details/4928778388?utm_medium=api&utm_source=4772744a,169208.19,169208.19
Python Developer,"Overview As a software engineer at PDF Solutions, you will develop tools to enable and drive production of the world’s most advanced chips. You will develop algorithms to develop new features and capabilities for our products. You will design and build component and system level test infrastructure You will be part scientist and part engineer, honing your skills while working side by side with industry experts with decades of experience. Responsibilities Multi-processing in windows / linux envi…",PDF Solutions,"Milpitas, Santa Clara County",https://www.adzuna.com/details/4907601788?utm_medium=api&utm_source=4772744a,125000.0,140000
Python Developer,"Job details are Shared below: Job Title: Software Engineer Location: Santa Clara, CA 95050 (Hybrid) Job Duration: 12 month contract, possible conversion Primary Skills: Deep knowledge of one or more languages including shell, Perl, Python, Java and/or Ruby Background in object-oriented programming Expertise in Database administration and SQL BS/MS Computer Science/Engineering Degree Deep knowledge of one or more languages including shell, Perl, Python, Java and/or Ruby Background in object-orie…","netPolarity, Inc. ","Santa Clara, Santa Clara County",https://www.adzuna.com/details/4932211494?utm_medium=api&utm_source=4772744a,121515.38,121515.38
Python Developer,"Description: Long term contract and have to go 2 to 3 days onsite Must have Big data experience. Advanced Level experience (8 years) with Python programming language handling Big Data Experience with Django and/or Flask Experience with PySpark Experience with implementing Data Science algorithms Experience with data munging/wrangling would be good to have Experience using third-party Python libraries including Pandas, Pyarrow, Numpy, etc. Experience with ML libraries like scikit-learn Experienc…",Diligente Technologies,"Fremont, Alameda County",https://www.adzuna.com/details/4932211206?utm_medium=api&utm_source=4772744a,94515.41,94515.41
Python Developer,"Disclaimer: Applicants must be authorized to work for ANY employer in the U.S. We are unable to sponsor or take over sponsorship of an employment Visa at this time. We're hiring for Mid to Senior level Python Engineers (US-Remote) Senior: 5 years of experience What you’ll do: Help translate product requirements into user stories and technical solutions Deliver highly available and scalable services in a production environment Mentor other engineers, support the technological culture, and help g…",Altimetrik,"California, US",https://www.adzuna.com/details/4912291339?utm_medium=api&utm_source=4772744a,108171.02,108171.02
Junior Python Developer,Recent grads/1 year of experience Python programming language handling Big Data Experience with Django and/or Flask Experience with PySpark,Sumeru Solutions,"Union City, Alameda County",https://www.adzuna.com/details/4936849033?utm_medium=api&utm_source=4772744a,81154.77,81154.77
Python Developer with DevOps,"Hi Professional Hope you are doing good, This is sangeetha rom Info Way Solutions, LLC We have job opening for Python Developer with DevOps at Austin, TX l ocation and the detailed Job description is given below: Position: Python Developer with DevOps Location: Austin, TX 12 Months Job Description: Impressive in Python software development Experience with AWS Capability to build systems from scratch Advanced or expert knowledge in AWS (AWS Lambda, AWS Batch, CloudSearch, AWS S3) Capability to s…",Info Way Solutions,"Fremont, Alameda County",https://www.adzuna.com/details/4928776496?utm_medium=api&utm_source=4772744a,102771.19,102771.19
Sr Python Developer,"Hi Professionals, Hope you are doing good This is Jayaraman from Info Way Solutions, LLC We have job opening for Sr Python Developer and the detailed Job description is given below: Kindly check the JD and share your views Sr Python Developer Maryland Summary of job description: Design, plan, and develop web services. Research cutting edge technologies and provide proof of concept applications demonstrating usage in the Census environment. Identify, research, create standards/documentation, and…",Info Way Solutions,"Fremont, Alameda County",https://www.adzuna.com/details/4928721353?utm_medium=api&utm_source=4772744a,138567.03,138567.03
Senior python developer,"Software engineer - python open source Onsite in San Francisco 5 days Base to $180k plus equity Are you an engineer who fell in love with python many years ago and have never looked back We have a super exciting opportunity to work on an open-source framework that empowers python developers to build web apps faster . With this framework you can build both your frontend and backend in a single language, python, with no Javascript or web development experience required. Sounds cool right? You hav…",Propeller-tech,"California, US",https://www.adzuna.com/details/4928938233?utm_medium=api&utm_source=4772744a,120164.3,120164.3
Senior Python Developer,"Senior Python Developer Job Title: Remote Senior Python Developer Location: 100% Remote Salary: $120,000 - $160,000 Requirements: 5 years with Python, Django, JavaScript, HTML, CSS, SQL, GIT Position Overview: We are a mid-sized company that has been around for over 10 years in the a Real Estate Investment industry. Our company contains $6 billion in assets in over 45 states. Our clients always meet or exceed their investment goals. We work with corporations that are necessity based in retail a…",CyberCoders,"Pasadena, Los Angeles County",https://www.adzuna.com/details/4939993576?utm_medium=api&utm_source=4772744a,120000.0,160000
Sr. Python Developer,"Interview : Video Visa : USC, GC, GC EAD, H4, L2 Client locations: San Ramon, CA, San Mateo, CA, Stamford, CT, NYC, NY This is hybrid from day-1 Description : Urgently hiring Senior Python developers (10 yrs, strong in coding, Data structures and Algorithms) for onsite position. Must Have 10 to 12 years or experience Hands-on experience in Python programming Good Analytical and problem-solving abilities Experience in Agile/Scrum based project executions Strong in leetcode problems, data structu…",ShiftCode Analytics,"San Ramon, Contra Costa County",https://www.adzuna.com/details/4928718677?utm_medium=api&utm_source=4772744a,116924.85,116924.85
Sr. PYTHON DEVELOPER,"Position:- Sr. PYTHON DEVELOPER Location:- Fremont CA (Onsite) Duration:- 6-12 Months Contract Job Description:- Advanced Level experience (8 years) with Python programming language handling Big Data Experience with Django and/or Flask Experience with PySpark Experience with implementing Data Science algorithms Experience with data munging/wrangling would be good to have Experience using third-party Python libraries including Pandas, Pyarrow, Numpy, etc . Experience with ML libraries like sciki…",The Crox Group,"Fremont, Alameda County",https://www.adzuna.com/details/4928940684?utm_medium=api&utm_source=4772744a,102833.93,102833.93
Junior Python Developer,"Since 2010 SynergisticIT has helped Jobseekers get employed in the tech Job market by providing candidates the requisite skills, experience and technical competence to outperform at interviews and at clients. The Tech Job market has been affected by massive layoffs and since 2021 there have been more than 600,000.00 tech layoffs. The Job market is Hyper Competitive. For 1 position 500-1000 candidates or more are applying and laid off job seekers are also competing for entry level Job positions.…",SynergisticIT,"Alameda, Alameda County",https://www.adzuna.com/details/4927227788?utm_medium=api&utm_source=4772744a,57567.99,57567.99
Remote Python Developer,"Since 2010 Synergisticit has helped Jobseekers get employed in the tech Job market by providing candidates the requisite skills, experience, and technical competence to outperform at interviews and clients. Here at SynergisticIT We just don't focus on getting you a tech Job we make careers. In this Job market also, our candidates can achieve multiple job offers and $100k  salaries. please check the below links to see the success outcomes and salaries of our candidates . https://www.synergistici…",SynergisticIT,"Textile Finance, Los Angeles County",https://www.adzuna.com/details/4928747069?utm_medium=api&utm_source=4772744a,69610.52,69610.52
Devops Engineer with Python Development,"Role Devops Engineer with Python Development Type 6months Contract Location Pleasanton, CA (Hybrid 3 days in a week) Experience - 10yrs Visa - Any Need Only Strong candidates Linkedin Must Need 12 Years of experience and only local resources. Need experience with Python Development, scripting experience will not work. - This is client location specific requirement for Bay Area CA. - Candidate need to attend office 3 days a week. - Candidate need to be local to the Bay Area, CA and available for…",Eagle Eye Technologies,"California, US",https://www.adzuna.com/details/4938119306?utm_medium=api&utm_source=4772744a,92686.79,92686.79
Sr Cloud Python Developer,"Hi Professionals, Hope you are doing good This is Jayaraman from Info Way Solutions, LLC We have job opening for Sr Cloud Python Developer and the detailed Job description is given below: Kindly check the JD and share your views Sr Cloud Python Developer Austin, TX or Sunnyvale, CA Onsite Job Python Developer with GCP certificate preferred Job Requirement: 10 Advanced knowledge of AWS/GCP Services/Architecture Experience in AWS/GCP Compute such as EC2/GCE,EKS/GKE, Lambda, Beanstalk, Batch or EC…",Info Way Solutions,"Fremont, Alameda County",https://www.adzuna.com/details/4928720859?utm_medium=api&utm_source=4772744a,154767.08,154767.08
Python Developer (Entry Level),"Python Developer (Entry Level), Full-Time, Salary $60K - $70K Minimum 1 year of work experience - Remote (US/Canada Residing people only, with work permit) About us: The Future of AI is Patterned We are a stealth-mode technology startup that is revolutionizing the way AI is used. Our platform uses pattern recognition to train AI models that are more accurate, efficient, and robust than ever before. We are backed by top investors, including Sequoia and Andreessen Horowitz, and we are hiring for …",Patterned Learning AI,"San Francisco, California",https://www.adzuna.com/details/4809796344?utm_medium=api&utm_source=4772744a,60000.0,70000
Senior Python Developer - CI,"Network Optix (Nx) is a global powerhouse in video software development, driven by a mission to empower the creation of intelligent video-based solutions and products capable of converting video into actionable data. Over a decade in the making, the Network Optix Enterprise Video Operating System helps innovative organizations rapidly and affordably build world-class, custom-tailored, enterprise-scale video products and solutions. Nx is headquartered in Walnut Creek, California with additional …",Network Optix,"Walnut Creek, Contra Costa County",https://www.adzuna.com/details/4901325220?utm_medium=api&utm_source=4772744a,150000.0,220000
Junior PYTHON DEVELOPER(Onsite interview),"Junior PYTHON DEVELOPER Fremont, California(Hybrid) Phone and Video Onsite interview Job Description: Whiteboarding Backfilling an offshore candidate to be onshore Project Description Team is focused on developing big data projects They don't use cloud services such as Google or AWS due to clients sensitivity in Data - so currenting operating off a on-premise cloud - utilizing all big data frameworks and dealing with Terabytes of data Duties/Day to Day Overview 6 hours of coding 2 hours collabo…",Stellent IT LLC,"Union City, Alameda County",https://www.adzuna.com/details/4936848716?utm_medium=api&utm_source=4772744a,86553.16,86553.16
REMOTE - Senior Python Developer - Galileo,"If you are open to new professional challenges and seeking a role where your skills can truly shine, I encourage you to consider this opportunity. If you find this opportunity aligns with your career goals and interests, we kindly request that you send us your documents to ishwaryajyothithethinkbeyond.com at your earliest convenience If you are not interested, please feel free to send over any names or forward this message to anyone who may be interested. Job Title: AMSEP233-Software Engineer -…",S M Software Solutions Inc,"San Jose, Santa Clara County",https://www.adzuna.com/details/4938040845?utm_medium=api&utm_source=4772744a,122774.12,122774.12
Python Developer with Fast API and Tornado,"Role: Python Developer with Fast API and Tornado (Must have) Location: Santa Clara, CA- Onsite Experience: 8 Year Duration:12 Months Must have skills: Elastic Search, Fast API, Tornado, Django Responsibilities: 1. Gathering early functional and non-functional requirements 2. Provide detailed technical architectural blueprints. 3. Setting quality standards & Change management. 4. Perform regular code reviews to ensure the design quality and avoid overly complicated structures. 5. Should have han…",Diverse Lynx,"Santa Clara, Santa Clara County",https://www.adzuna.com/details/4928721259?utm_medium=api&utm_source=4772744a,142536.5,142536.5
Remote Python Developer with Strong SQL Skills,"Job Overview We are seeking a skilled Python Developer with a strong proficiency in SQL to join our dynamic team in a fully remote capacity. This role emphasizes developing and maintaining robust RESTful API backend services while leveraging advanced technologies. The successful candidate will be a key player in our tech initiatives, showcasing their expertise in Python and SQL to drive impactful results. Key Responsibilities Develop and sustain RESTful API backend services utilizing Python, Fl…",Get It - Professional Services,"Los Angeles, Los Angeles County",https://www.adzuna.com/details/4937736895?utm_medium=api&utm_source=4772744a,84879.39,84879.39
Senior Python Developer - System Integration Testing,"Network Optix (Nx) is a global powerhouse in video software development, driven by a mission to empower the creation of intelligent video-based solutions and products capable of converting video into actionable data. Over a decade in the making, the Network Optix Enterprise Video Operating System helps innovative organizations rapidly and affordably build world-class, custom-tailored, enterprise-scale video products and solutions. Nx is headquartered in Walnut Creek, California with additional …",Network Optix,"Walnut Creek, Contra Costa County",https://www.adzuna.com/details/4857608755?utm_medium=api&utm_source=4772744a,150000.0,200000
Python Backend developer,"Python Backend developer Work Location: San Ramon, CA (Needed only Locals 30-40 miles) Work Mode : Day 1 onsite. Mode of Interview: F2F only JD: 10-12 years or experience Hands-on experience in Python Scripts Good Analytical and problem-solving abilities Experience in Agile/Scrum based project executions Nice to Have Knowledge on Cloud App services, Load Balancer, Application Gateway Hand on with Cloud services preferably Azure Experience in NoSQL Database and in-memory Database Experience in U…",Marvel Infotech,"San Ramon, Contra Costa County",https://www.adzuna.com/details/4939478633?utm_medium=api&utm_source=4772744a,115200.0,N/A
Python Backend developer,"Role 2: Python Backend developer Work Location: San Ramon, CA (Needed only Locals 30-40 miles) Work Mode : Day 1 onsite. Mode of Interview: F2F only 10-12 years or experience Hands-on experience in Python Scripts Good Analytical and problem-solving abilities Experience in Agile/Scrum based project executions Nice to Have Knowledge on Cloud App services, Load Balancer, Application Gateway Hand on with Cloud services preferably Azure Experience in NoSQL Database and in-memory Database Experience …",Cloud BC Labs,"San Ramon, Contra Costa County",https://www.adzuna.com/details/4938118392?utm_medium=api&utm_source=4772744a,88253.7,88253.7
Python/R Developer,"Since 2010 Synergisticit has helped Jobseekers get employed in the tech Job market by providing candidates the requisite skills, experience and technical competence to outperform at interviews and at clients. Here at SynergisticIT We just don't focus on getting you a tech Job we make careers. In this Job market also, our candidates are able to achieve multiple job offers and $100k  salaries. please check the below links to see success outcomes, salaries of our candidates . https://www.synergist…",SynergisticIT,"Oildale, Kern County",https://www.adzuna.com/details/4935547518?utm_medium=api&utm_source=4772744a,82061.45,82061.45
Senior Observability Platform Developer - Python/Go,"Job Description Job Description Canonical seeks an experienced developer with a proven track record in Python and/or Go. As part of the Observability team, you will develop a cloud-native monitoring stack that composes best-in-class open-source monitoring tools. The stack is opinionated, resilient, and scalable, providing deep insights out of the box. The user experience is polished and seamless for the end-users, and its administrators will enjoy smooth, lightweight Day 1 and Day 2 operations.…",Canonical - Jobs,"Sacramento, Sacramento County",https://www.adzuna.com/land/ad/4940356886?se=0KPlTbSj7xG65D1_wqcsRg&utm_medium=api&utm_source=4772744a&v=F4AF401FF817A4BBCB17ED440AB287A476F3E4E6,161468.81,161468.81
Senior Observability Platform Developer - Python/Go,"Job Description Job Description Canonical seeks an experienced developer with a proven track record in Python and/or Go. As part of the Observability team, you will develop a cloud-native monitoring stack that composes best-in-class open-source monitoring tools. The stack is opinionated, resilient, and scalable, providing deep insights out of the box. The user experience is polished and seamless for the end-users, and its administrators will enjoy smooth, lightweight Day 1 and Day 2 operations.…",Canonical - Jobs,"Fresno, Fresno County",https://www.adzuna.com/land/ad/4940358578?se=0KPlTbSj7xG65D1_wqcsRg&utm_medium=api&utm_source=4772744a&v=8777FB16F739E208F0FEC4EC20C624D67ABC58CC,153947.28,153947.28
Senior Observability Platform Developer - Python/Go,"Job Description Job Description Canonical seeks an experienced developer with a proven track record in Python and/or Go. As part of the Observability team, you will develop a cloud-native monitoring stack that composes best-in-class open-source monitoring tools. The stack is opinionated, resilient, and scalable, providing deep insights out of the box. The user experience is polished and seamless for the end-users, and its administrators will enjoy smooth, lightweight Day 1 and Day 2 operations.…",Canonical - Jobs,"Los Angeles, Los Angeles County",https://www.adzuna.com/land/ad/4940361822?se=0KPlTbSj7xG65D1_wqcsRg&utm_medium=api&utm_source=4772744a&v=8A457CA8EFBCD5150D8F2B4A4F7EC5E3CB39E3BA,158211.84,158211.84
