Title,Job Description,Employer,Location,URL,Minimum Salary,Maximum Salary
"Data Analyst, Programs","ABOUT US: - We believe that everyone deserves a home Breaking Ground operates nearly 4,000 units of housing across New York City, along with housing in upstate New York and Connecticut. Supportive housing - affordable housing paired with services designed to help people maintain their homes for the long-term - is widely recognized as a proven and cost-effective solution to chronic homelessness. But we didn't stop at providing housing. Breaking Ground's programs and services help people experien…",Breaking Ground,"Chelsea and Clinton, Manhattan",https://www.adzuna.com/details/4902421909?utm_medium=api&utm_source=4772744a,60000.0,60000
Data Analyst (Contractor),"A pioneer in K-12 education since 2000, Amplify is leading the way in next-generation curriculum and assessment. Our core and supplemental programs in ELA, math, and science engage all students in rigorous learning and inspire them to think deeply, creatively, and for themselves. Our formative assessment products help teachers identify the targeted instruction students need to build a strong foundation in early reading and math. All of our programs provide educators with powerful tools that hel…",Amplify,"New York City, New York",https://www.adzuna.com/details/4932692100?utm_medium=api&utm_source=4772744a,79804.75,79804.75
Data Analyst Specialist,"About SideRamp SideRamp allows professionals to engage with part-time opportunities in the gig economy, offering a centralized platform that manages high-quality, flexible side gigs. We focus on connecting our users to various freelance and part-time work—from discovering opportunities to streamlining the application process. About The Role Are you a data enthusiast with a knack for transforming numbers into actionable insights? We are seeking a Data Analyst Specialist to join our dynamic team …",SideRamp,"New York City, New York",https://www.adzuna.com/details/4917683570?utm_medium=api&utm_source=4772744a,94092.89,94092.89
Senior Data Analyst,"Trident Consulting is looking for a "" Data Analyst with Investment banking"" to join one of our prestigious clients. Position: Data Analyst with Investment banking Location: Jersey City, NJ Type: Fulltime Note: No C2C and looking only local to NJ, NY Candidates Mandatory Skills: Investment Banking and strong SQL analytics Requirements A proven track record with 10 years or more of relevant analytics work experience and demonstrated career progression/increase in responsibilities Strong experienc…",Trident Consulting,"Jersey City, Hudson County",https://www.adzuna.com/details/4932213178?utm_medium=api&utm_source=4772744a,120485.71,120485.71
Financial Data Analyst,"Finance & Accounting | Financial Technology | Associate, Data Analyst | NYC About ING : Ranked 8 on LinkedIn Top Companies in Financial Services Crain’s 100 Best Places to Work Ragan’s Top Places to Work in 2023 In Americas, ING’s Wholesale Banking division offers a broad range of innovative financial products and services to domestic and international corporate and institutional clients. When you come to work at ING, you’re joining a team where individuality isn’t just accepted, it’s encourage…",ING,"New York City, New York",https://www.adzuna.com/details/4805334818?utm_medium=api&utm_source=4772744a,105000.0,140000
Senior Data Analyst,"Title: Sr Data Analyst Location: Jersey City NJ/Plano TX Email: mohammed.ahmed3synechron.com Additional Information The base salary for this position will vary based on geography and other factors. In accordance with law, the base salary for this role if filled within Jersey City NJ and Plano TX is $105k - $110k/year & benefits (see below). Job Description: We are seeking a detail-oriented and analytical Data Analyst to join our team focused on building the next generation model development and…",Synechron,"Jersey City, Hudson County",https://www.adzuna.com/details/4912288358?utm_medium=api&utm_source=4772744a,102369.94,102369.94
Marketing Data Analyst,"Job Description: · As a Marketing Data Analyst, you will work providing insights, measurement expertise and strategic recommendations to some of the most digitally savvy global brands in the world in the FBR, HPC and Beauty verticals. · This is a data-oriented yet creative position that requires a sharp, analytical mind and an entrepreneurial spirit. Your knowledge of our internal and third party tools, as well as deep measurement expertise, combined with your curiosity to play with data combin…",US Tech Solutions,"Grand Central, Manhattan",https://www.adzuna.com/details/4687974701?utm_medium=api&utm_source=4772744a,78489.9,78489.9
Marketing Data Analyst,"Job Description: · As a Marketing Data Analyst, you will work providing insights, measurement expertise and strategic recommendations to some of the most digitally savvy global brands in the world in the FBR, HPC and Beauty verticals. · This is a data-oriented yet creative position that requires a sharp, analytical mind and an entrepreneurial spirit. Your knowledge of our internal and third party tools, as well as deep measurement expertise, combined with your curiosity to play with data combin…",US Tech Solutions,"New York City, New York",https://www.adzuna.com/details/4914027924?utm_medium=api&utm_source=4772744a,85508.08,85508.08
AVP Data Analyst,"AVP Data Analyst Enterprise Data Management Office MUST be local to New York City, Hybrid Schedule at least 3 days onsite No Sponsorship Salary Range: $77k to 135k No Relocation You must be working at a financial firm and have strong experience with automated data extraction from ServiceNow and analyzing data for weaknesses. Common Service Data Model experience is a huge plus. Without financial and ServiceNow your resume will not be reviewed . Key Responsibilities: Maintain documentation of dat…",Shulman Fleming & Partners,"Grand Central, Manhattan",https://www.adzuna.com/details/4900501719?utm_medium=api&utm_source=4772744a,77000.0,135000
Temporary Data Analyst,"About MSF USA | Doctors Without Borders Doctors Without Borders/Médecins Sans Frontières (MSF) is an independent international organization that provides medical care to the people who need it most. The organization cares for people affected by conflict, disease outbreaks, disasters, and social exclusion in more than 70 countries. MSF offers medical humanitarian assistance solely based on need, regardless of race, ethnicity, religion, or politics. Our international project teams include medical…",Medecins Sans Frontieres,"Grand Central, Manhattan",https://www.adzuna.com/details/4935094083?utm_medium=api&utm_source=4772744a,67590.62,67590.62
staff data analyst,"Craft: Data, Analytics & Strategy Job Description: Job Title: Staff Data Analyst | Activision Blizzard Media Reports To: Data Analyst Manager Location: New York, NY (Hybrid) Activision Blizzard Media ('ABM') is a rapidly growing business crafted to connect advertisers with our 400MM global player base across Activision, Blizzard, and King. Are you interested in crafting powerful marketing solutions embraced by the world's biggest marketers? At Activision Blizzard Media, we seek a passionate and…",King,"New York City, New York",https://www.adzuna.com/details/4929914603?utm_medium=api&utm_source=4772744a,120802.0,120802
Data Analyst II,"Job Title: Hybrid Data Analyst II Location: Brooklyn, NY - Hansen Place (In-office 1-2 times a week) Shift: Standard Business Hours, M - F Work Type: Contract with possibility of extending based on business needs. Position Overview: We are seeking a creative and skilled Data Analyst II to join our team located in Brooklyn, NY. The ideal candidate will have a strong background in data analysis, with advanced proficiency in Power BI, Python, and SQL. This role offers a collaborative environment w…",LHH Recruitment Solutions,"Flatbush, Brooklyn",https://www.adzuna.com/details/4933477344?utm_medium=api&utm_source=4772744a,105742.06,105742.06
Data Analyst Intern,"About : City Wonders is a dynamic and innovative company. We are committed to excellence and offer exciting opportunities for interns to gain valuable experience in the field of data analysis. Position Overview: Are you a detail-oriented and analytical individual with a passion for data? Wonders is seeking a talented Data Analyst Intern to join our team. This internship provides a unique opportunity to work closely with our data professionals, learn valuable skills, and contribute to meaningful…",CityWonders,"Franklin D Roosevelt, Manhattan",https://www.adzuna.com/details/4809906577?utm_medium=api&utm_source=4772744a,42300.03,42300.03
"Data Analyst, Nonfiction Job","Data Analyst, Nonfiction Penguin Random House is currently seeking a Data Analyst to help drive decisions for a demand-focused, trend-driven publishing program across a variety of genres. This unique and data-driven role will work in conjunction with editorial, sales, advertising and marketing to quickly bring timely nonfiction books to market. Other responsibilities include: Compiling search, purchase, trend, and other consumer data from multiple sources into actionable reports and recommendat…",Open Position,"Meadows, Hudson County",https://www.adzuna.com/details/4804392351?utm_medium=api&utm_source=4772744a,74248.07,74248.07
Tableau Data Analyst,"UNIVERSAL Technologies is seeking a Tableau Data Analyst for a remote role. All consultants will be working 100% remotely, and we prefer candidates located in the EST time zone with an active LinkedIn account. Position: The Tableau Data Analyst will be responsible for gathering and analyzing data, building complex dashboards using Tableau, and supporting data-driven initiatives. The consultant will develop and maintain data visualizations to support decision-making across departments, ensuring …","UNIVERSAL Technologies, LLC","Grand Central, Manhattan",https://www.adzuna.com/details/4905625535?utm_medium=api&utm_source=4772744a,71368.61,71368.61
Data Analyst Intern,"Description We are seeking an ambitious, self-starter to join our team as a Data Analyst Intern. You will be responsible for collecting, analyzing, and reporting on client data. This is a unique opportunity to gain invaluable experience working directly with the senior management to build out the Portfolio Optimization department in a rapidly growing company. Successful interns are given a clear path to full time employment postgraduation. Responsibilities Capture, clean and prepare data and an…",Paul Bednar,"Cooper, Manhattan",https://www.adzuna.com/details/4809957954?utm_medium=api&utm_source=4772744a,49531.62,49531.62
Clinical Data Analyst,"The Clover Care Services organization delivers proactive support and care to our members through our Clover Home Care teams, and quality improvement services to our aligned insurance plan providers through our practice engagement team. We have built one of the most proactive, data-driven health care services platforms in New Jersey and are excited about the future of technology and how it impacts our ability to bring transformative results to both patients and providers. As a Clinical Data Anal…",Clover Health,"Jersey City, Hudson County",https://www.adzuna.com/details/4924304525?utm_medium=api&utm_source=4772744a,122052.19,122052.19
Business/Data Analyst,"Description We are offering a contract opportunity for a Business/Data Analyst in New York, NY 10013. As part of our team, the selected individual will be instrumental in analyzing data, collaborating with cross-functional teams, and supporting financial decision-making processes. Responsibilities: - Conduct basic data and financial analysis to support business decisions. - Utilize Excel for data manipulation, analysis, and reporting. - Assist in the development and maintenance of financial mod…",Robert Half,"Grand Central, Manhattan",https://www.adzuna.com/details/4911635432?utm_medium=api&utm_source=4772744a,39917.66,39917.66
Data Analyst - Internship,"SeatGeek believes live events are powerful experiences that unite humans. With our technological savvy and fan-first attitude we’re simplifying and modernizing the ticketing industry. By catering to both consumers and businesses, we’re powering a new, open entertainment ecosystem where fans have effortless access to experiences, and teams, venues, and shows have seamless access to their audiences. Because everyone should expect more from ticketing. Make your mark We are hiring Data Analyst Inte…",SeatGeek,"New York City, New York",https://www.adzuna.com/details/4888528669?utm_medium=api&utm_source=4772744a,98450.27,98450.27
Senior Data Analyst,"Job Description Job Description StubHub is on a mission to redefine the live event experience on a global scale. Whether someone is looking to attend their first event or their hundredth, we're here to delight them all the way from the moment they start looking for a ticket until they step through the gate. The same goes for our sellers. From fans selling a single ticket to the promoters of a worldwide stadium tour, we want StubHub to be the safest, most convenient way to offer a ticket to the …",StubHub,"New York City, New York",https://www.adzuna.com/details/4940344846?utm_medium=api&utm_source=4772744a,134316.7,134316.7
Senior Data Analyst,"Array is a financial innovation platform that helps digital brands, financial institutions, and fintechs get compelling consumer products to market faster. We deliver a suite of credit and identity monitoring tools, privacy protection, and a financial ads marketplace via embeddable widgets or a clean, modern API. Our private label offerings help drive revenue and increase engagement for our customers while empowering millions of consumers to achieve their financial goals. As a remote-first comp…",Array,"New York City, New York",https://www.adzuna.com/details/4892210186?utm_medium=api&utm_source=4772744a,85518.77,85518.77
Senior Data Analyst,"The Team & Role The SevenRooms Data & Analytics team is looking for a Senior Data Analyst to work closely with our business teams in development and support of business initiatives, as well as to contribute to the development of the data culture at SevenRooms. In this role, you will work with our business partners to develop data products, and analyze data related to our Go-to-Market teams (Sales, Customer Success, Support, RevOps, and Marketing). You will be directly responsible for supporting…",SevenRooms,"Grand Central, Manhattan",https://www.adzuna.com/details/4928780394?utm_medium=api&utm_source=4772744a,148238.27,148238.27
Pharmacy Data Analyst,"The challenges of affordable healthcare continue to create new opportunities. Elderplan and HomeFirst, our Medicare and Medicaid managed care health plans, are outstanding examples of how we are expanding services in response to our patients' and members' needs. These high-quality healthcare plans are designed to help keep people independent and living life on their own terms. Perform duties to support the efforts to meet the Pharmacy Department goals and initiatives, which include improvement …",MJHS,"Fort George, Manhattan",https://www.adzuna.com/details/4863399206?utm_medium=api&utm_source=4772744a,77671.26,77671.26
Pharmacy Data Analyst,"The challenges of affordable healthcare continue to create new opportunities. Elderplan and HomeFirst, our Medicare and Medicaid managed care health plans, are outstanding examples of how we are expanding services in response to our patients' and members' needs. These high-quality healthcare plans are designed to help keep people independent and living life on their own terms. When you work with us you will receive comprehensive and affordable health and financial benefits, in addition to gener…",MJHS,"Wall Street, Manhattan",https://www.adzuna.com/details/4863982033?utm_medium=api&utm_source=4772744a,77099.0,92519
INTERN - DATA ANALYST,"The internship position in the Office of the Special Adviser on Africa is for a period of two months, subject to extension based on the needs of the Office. Responsibilities The programme is normally full-time, i.e. an intern is expected to work five days per week (9:00 a.m. - 5:00 p.m.) in the department or office of the Secretariat to which he/she is assigned, carrying out his/her tasks under the supervision of a staff member - the supervisor. Daily responsibilities will include: Support team…",The UN Office of the Special Adviser on Africa,"New York City, New York",https://www.adzuna.com/details/4904255344?utm_medium=api&utm_source=4772744a,44493.24,44493.24
Senior Data Analyst,"1stDibs is a one-of-a-kind online marketplace that connects design lovers to more than one million extraordinary pieces, from furniture and fine art to jewelry and fashion. As a leading global marketplace for design lovers, we enable shoppers to discover beautiful things and engage with top sellers from around the world. We encourage our shoppers to interact with sellers throughout all stages of the transaction, including item inquiries, price negotiations and customization requests. You’re a n…",1stdibs.com,"New York City, New York",https://www.adzuna.com/details/4900505109?utm_medium=api&utm_source=4772744a,114768.9,114768.9
Senior Data Analyst,"What We Do Wagmo is a new type of pet health company. We are a pet parent's partner in pet parenting - from everyday care to rainy-day emergencies. We offer wellness plans that keep our members on budget and insurance plans that keep them ready for the unexpected either directly or through a pet parent’s employer benefits. Our members should always feel confident they are giving their pets the care they deserve. No matter how a member joins us, Wagmo is a dedicated partner for the whole journey…",Wagmo,"New York City, New York",https://www.adzuna.com/details/4802605174?utm_medium=api&utm_source=4772744a,107733.79,107733.79
Operations Data Analyst,"The New York City Department of Correction (DOC) is an integral part of the City’s evolving criminal justice system, participating in reform initiatives and strategies aimed to move the City towards a smaller jail system without compromising public safety. The DOC is responsible for maintaining a safe and secure environment for our employees, visitors, volunteers, and people in our custody. Importantly, safe jails enable DOC to provide people in custody with the tools and opportunities they nee…",City of New York,"Queens, New York City",https://www.adzuna.com/details/4906639357?utm_medium=api&utm_source=4772744a,67998.71,67998.71
ODAR Data Analyst,"Position Summary: At MedReview, our mission is to bring accuracy, accountability, and clinical excellence to healthcare. As such, we are a leading authority in payment integrity solutions including DRG Validation, Cost Outlier and Readmission reviews. The ODAR Resolution Analyst role is responsible for the monitoring, triaging, routing, and working audited claims flagged with an inquiry to (1) confirm action needed to facilitate resolution, and (2) ensuring confirmed action is taken by responsi…",MedReview,"Peck Slip, Manhattan",https://www.adzuna.com/details/4882144652?utm_medium=api&utm_source=4772744a,48000.0,57600
Regulatory Data Analyst,"Company Federal Reserve Bank of New York Working at the Federal Reserve Bank of New York positions you at the center of the financial world with a unique perspective on national and international markets and economies. You will work in an environment with a diverse group of experienced professionals to foster and support the safety, soundness, and vitality of our economic and financial systems. The Bank believes in work flexibility to balance the demands of work and life while also connecting a…",Federal Reserve Bank ,"Chelsea and Clinton, Manhattan",https://www.adzuna.com/details/4921856735?utm_medium=api&utm_source=4772744a,84600.0,84600
Data Analyst II,"Elsevier employs 9,200 people worldwide, including over 2,500 technologists. We have supported the work of our research and health partners for more than 140 years. Growing from our roots in publishing, we offer knowledge and valuable analytics that help our users make breakthroughs and drive societal progress . About the team: Elsevier's Global Strategic Networks (GSN) team is focused on building and nurturing relationships with influential stakeholders in academia, industry, and government. T…",RELX INC,"Grand Central, Manhattan",https://www.adzuna.com/details/4922485483?utm_medium=api&utm_source=4772744a,100207.61,100207.61
Market Research Data Analyst,"iPullRank is an ambitious ten-year-old digital marketing agency based in New York City and founded by industry thought leader Michael King. Our mission is to drive results for our clients by delivering marketing work that we can be PROUD of. Oh, and our value set is PROUD: P – Proactive; R – Reliable; O – Outstanding; U – Useful; D – Dedicated. We keep that front and center on a day-to-day basis. If you’re curious about what types of clients we work with, they range from Fortune 500 brands to m…",iPullRank,"Bushwick and Williamsburg, Brooklyn",https://www.adzuna.com/details/4911318428?utm_medium=api&utm_source=4772744a,80518.46,80518.46
Data Analyst 2 (Actuarial),"NY HELP No Agency Insurance Fund, State Title Data Analyst 2 (Actuarial) Occupational Category Other Professional Careers Salary Grade 23 Bargaining Unit PS&T - Professional, Scientific, and Technical (PEF) Salary Range From $87556 to $109854 Annually Employment Type Full-Time Appointment Type Permanent Jurisdictional Class Non-competitive Class Travel Percentage 10% Workweek Mon-Fri Hours Per Week 37.5 Workday From 8 AM To 5 PM Flextime allowed? No Mandatory overtime? No Compressed workweek al…",New York State Civil Service,"Grand Central, Manhattan",https://www.adzuna.com/details/4931849050?utm_medium=api&utm_source=4772744a,99707.81,99707.81
Managing Healthcare Data Analyst,"Managing Healthcare Data Analyst New York, NY, USA Req 1048 Friday, October 25, 2024 Staffing Solutions Organization LLC (SSO), an affiliate of Public Consulting Group LLC (PCG), is focused on delighting clients with world-class managed staffing and talent consulting services. SSO is committed to a diverse workforce, which is a reflection of our clients and the people they serve. Managing Healthcare Data Analyst - NYC DOS 1265 Summary This candidate would serve as a managing health care data an…",Staffing Solutions Organization,"Grand Central, Manhattan",https://www.adzuna.com/details/4915290339?utm_medium=api&utm_source=4772744a,106442.61,106442.61
Senior Data Analyst Hybrid,"Job Title : Senior Data Analyst - Hybrid ( Only Local ) Location: Suite 2300 Brooklyn, NY,11201 Job Type : Hybrid Duration : 72 months Opening : 1 Opening  The Senior Data Analyst will primarily be responsible for detailed field level analysis, profiling, metadata analysis and mapping of the current IBM Mainframe VSAM files into relational/dimensional SQL tables, create and maintain the master data dictionary, assist in database design and mapping to NYCERS mission critical applications and inv…",CyberTec,"Grand Central, Manhattan",https://www.adzuna.com/details/4928776764?utm_medium=api&utm_source=4772744a,86329.02,86329.02
Data Analyst with Investment banking,"Trident Consulting is seeking a "" Data Analyst with Investment banking "" for one of our clients in "" Jersey City, NJ "". Position: Data Analyst with Investment banking Location: Jersey City, NJ Type: Fulltime - No C2C Looking only local to NJ, NY Candidates Mandatory Skills: Investment Banking and strong SQL analytics Requirements A proven track record with 10 years or more of relevant analytics work experience and demonstrated career progression/increase in responsibilities Strong experience of…",Trident Consulting,"Jersey City, Hudson County",https://www.adzuna.com/details/4927607831?utm_medium=api&utm_source=4772744a,120000.0,N/A
IT Domain Data Analyst,"Mizuho - Enterprise Data Management Office The Enterprise Data Management function is responsible for effective and consistent Data Management of the bank's data which in deemed critical: Used in external reporting, used to continuously provide information to bank management, and data whose deficiency can cause financial loss/severe impact to the customer. Mizuho's data operating model comprise of enterprise-wide groups and federated data domains to drive accountability and management of data. …",Mizuho Americas,"Grand Central, Manhattan",https://www.adzuna.com/details/4935663642?utm_medium=api&utm_source=4772744a,103104.47,103104.47
Data Analyst II-US,"Below is the Job Description for your reference:- Role: Data Analyst Location: Brooklyn, NY Duration: 6 Months Contract Pay Rate: $40-$50/hr W2 Description: We are looking for a creative and experienced data analyst with strong proficiency in Power BI, Python and data workflow construction. The ideal candidate will have a deep understanding of data visualization techniques and the ability to work effectively with business stakeholders. Strong experience in Power BI is essential, with certificat…",LanceSoft,"Grand Central, Manhattan",https://www.adzuna.com/details/4933260486?utm_medium=api&utm_source=4772744a,76231.31,76231.31
