Title,Job Description,Employer,Location,URL,Minimum Salary,Maximum Salary
Senior Observability Platform Developer - Python/Go,"Job Description Job Description Canonical seeks an experienced developer with a proven track record in Python and/or Go. As part of the Observability team, you will develop a cloud-native monitoring stack that composes best-in-class open-source monitoring tools. The stack is opinionated, resilient, and scalable, providing deep insights out of the box. The user experience is polished and seamless for the end-users, and its administrators will enjoy smooth, lightweight Day 1 and Day 2 operations.…",Canonical - Jobs,"San Bernardino, San Bernardino County",https://www.adzuna.com/land/ad/4940362124?se=0KPlTbSj7xG65D1_wqcsRg&utm_medium=api&utm_source=4772744a&v=61013BEEF276EEC344008F07FD62B0D471C9F504,146650.05,146650.05
Senior Observability Platform Developer - Python/Go,"Job Description Job Description Canonical seeks an experienced developer with a proven track record in Python and/or Go. As part of the Observability team, you will develop a cloud-native monitoring stack that composes best-in-class open-source monitoring tools. The stack is opinionated, resilient, and scalable, providing deep insights out of the box. The user experience is polished and seamless for the end-users, and its administrators will enjoy smooth, lightweight Day 1 and Day 2 operations.…",Canonical - Jobs,"San Diego, San Diego County",https://www.adzuna.com/land/ad/4940360501?se=0KPlTbSj7xG65D1_wqcsRg&utm_medium=api&utm_source=4772744a&v=CA5D834E1615ECAD236BFA53EF8A3107163DE87B,151040.95,151040.95
Senior Observability Platform Developer - Python/Go,"Job Description Job Description Canonical seeks an experienced developer with a proven track record in Python and/or Go. As part of the Observability team, you will develop a cloud-native monitoring stack that composes best-in-class open-source monitoring tools. The stack is opinionated, resilient, and scalable, providing deep insights out of the box. The user experience is polished and seamless for the end-users, and its administrators will enjoy smooth, lightweight Day 1 and Day 2 operations.…",Canonical - Jobs,"San Jose, Santa Clara County",https://www.adzuna.com/land/ad/4940355422?se=0KPlTbSj7xG65D1_wqcsRg&utm_medium=api&utm_source=4772744a&v=1C9BFD345D46379D21A7108A9225F4733D00E2FA,160427.98,160427.98
"Python Full Stack Developer at San Ramon, CA","Job Description Job Description Python Full Stack Developer Work Location: San Ramon, CA (Needed only Locals 30-40 miles) Work Mode : Day 1 onsite. Mode of Interview: F2F only Required Skills: Hands-on & In depth knowledge of Python application programming concepts, Django REST framework, Flask Create services as part of back-end: message intake and processing pipelines (message flow), REST APIs for front-end, data manipulation (JSON,XML, flat), external services calling. Including Pandas, Pyte…",Marvel Infotech,"San Ramon, Contra Costa County",https://www.adzuna.com/land/ad/4940319085?se=rOxWTrSj7xG65D1_wqcsRg&utm_medium=api&utm_source=4772744a&v=C9772954C9AC80A44BF5B638B5F786FED9DB728E,52104.16,52104.16
Python Api developer with playwright,"Hi Professionals, Hope you are doing good This is Jayaraman from Info Way Solutions, LLC We have job opening for Fullstack Developer (Frontend) and the detailed Job description is given below: Kindly check the JD and share your views Python Api developer with playwright Austin, TX Onsite Job Detailed JD 6 years of automation testing experience in Python and Playwright Roles and Responsibilities Strong Playwright/Python skills Implement automatic web front-end tests infor Python Run the python t…",Info Way Solutions,"Fremont, Alameda County",https://www.adzuna.com/details/4928721007?utm_medium=api&utm_source=4772744a,113224.61,113224.61
Test Python Automation Developer,"About HCLTech: HCLTech is a global technology company, home to 221,000 people across 60 countries, delivering industry-leading capabilities centered around digital, engineering and cloud, powered by a broad portfolio of technology services and products. We work with clients across all major verticals, providing industry solutions for Financial Services, Manufacturing, Life Sciences and Healthcare, Technology and Services, Telecom and Media, Retail and CPG, and Public Services. To learn how we c…",HCLTech,"Fremont, Alameda County",https://www.adzuna.com/details/4932211441?utm_medium=api&utm_source=4772744a,167194.44,167194.44
"Software Developer (Python Developer) - Full Time - San Diego, CA - Onsite","Job Title: Software Developer (Python Developer) Job Location: San Diego, CA - Onsite Duration: Full Time Executive Summary : Applications will be used by their Security Operations Center and other analysts to enhance the security of their network. We are seeking personnel with at least 3 years of experience who have a desire to work as part of a small, agile team to enhance four existing applications and develop one new application primarily using Python. Specific job duties include, but are n…",Lorven Technologies,"San Diego, San Diego County",https://www.adzuna.com/details/4928714279?utm_medium=api&utm_source=4772744a,85547.48,85547.48
Python Chatbot Developer (1099 Contractor),"About the job Python Chatbot Developer (1099 Contractor) Job brief We are seeking a contract Python developer to create and enhance conversational AI chatbots using frameworks like LangChain. This is a remote, project-based 1099 contractor position. Responsibilities Develop, implement and maintain Python-based chatbots for multiple business use cases. Integrate intelligent chatbots with upstream and downstream data and systems Enhance natural language processing performance via frameworks like …",VSimplifyIT,"Florin, Sacramento County",https://www.adzuna.com/details/4928719114?utm_medium=api&utm_source=4772744a,63770.96,63770.96
Full-stack developer (Java & Python),"Project Description: Model Servicing/Content Automation project, to automate the model portfolio content and data displays on our client's website, that are being done manually through Adobe Authoring. Responsibilities: - Work closely with business team, business analysts, and architects and be able to quickly understand the new requirements and helps to identify the changes to the system. - Work closely on a day-to-day basis with development team, designers, copy writers and other IT teams. - …",Luxoft,"Irvine, Orange County",https://www.adzuna.com/land/ad/4934023203?se=rOxWTrSj7xG65D1_wqcsRg&utm_medium=api&utm_source=4772744a&v=BB184D949DEF286648AA3E86C5CD08E5777C0C47,109865.46,109865.46
Palantir Tech lead- Remote,"Job Summary Cognizant (NASDAQ: CTSH) is a leading provider of information technology, consulting, and business process outsourcing services, dedicated to helping the world's leading companies build stronger businesses. Headquartered in Teaneck, New Jersey (U.S.). Cognizant is a member of the NASDAQ-100, the S&P 500, the Forbes Global 1000, and the Fortune 500 and we are among the top performing and fastest growing companies in the world. Practice - AIA - Artificial Intelligence and Analytics Ab…",Cognizant,"San Ramon, Contra Costa County",https://www.adzuna.com/land/ad/4933806407?se=rOxWTrSj7xG65D1_wqcsRg&utm_medium=api&utm_source=4772744a&v=1664A577EB0AC72241C330D0F1758943679B7D6C,136112.05,136112.05
Python Full Stack Developer,"Role : Python Full Stack Developer Work Location: San Ramon, CA (Needed only Locals 30-40 miles) Work Mode : Day 1 onsite. Mode of Interview: F2F only Required Skills: Hands-on & In depth knowledge of Python application programming concepts, Django REST framework, Flask Create services as part of back-end: message intake and processing pipelines (message flow), REST APIs for front-end, data manipulation (JSON,XML, flat), external services calling. Including Pandas, Pytest, Exception handling, M…",Cloud BC Labs,"San Ramon, Contra Costa County",https://www.adzuna.com/details/4938118394?utm_medium=api&utm_source=4772744a,87334.05,87334.05
Blender Plugin Developer (Python),"Voia’s AI platform revolutionizes professional video production. We combine 3D rendering with predictive and generative AI to enable video makers create Hollywood grade visuals. We combine iPhone-based capture technology with cloud AI processing and 3D rendering to seamlessly place live action performance inside cinematic virtual environments. Our technology makes it easier, faster and much cheaper to produce professional looking videos. The Role We're looking for a skilled Python Developer wit…",Voia,"Sunnyvale, Santa Clara County",https://www.adzuna.com/details/4907841247?utm_medium=api&utm_source=4772744a,82744.91,82744.91
Python Full Stack Developer,"Position : Python Full Stack Developer Location : Cupertino, CA (Onsite) Duration : W2 / C2C Contract Experience : 8-10 Years Job Description : Python, DevOps, Full Stack Work Digital : Python, Digital : DevOps Continuous Integration and Continuous Delivery (CI/CD), Digital : Python Web Frameworks, Digital : Jenkins 5 Years Experience in Full StackGood Experience in Python or BashMandatory CI/CD and Jenkins ExperienceMandatory Flask or Django Experience Good Communication SkillsDocker / Kuberne…",Syntricate Technologies,"Hayes Valley, San Francisco",https://www.adzuna.com/details/4928720801?utm_medium=api&utm_source=4772744a,69469.53,69469.53
Senior Python Engineer,"Job Description Job Description Job description About Us: Mutual funds asset management is a financial company focused on building innovative solutions. We are seeking a Senior Python Developer to join our team and help us deliver high-quality products. Job Summary: As a Senior Python Developer, you will be responsible for designing, developing, and maintaining software applications using Python. You will work closely with cross-functional teams to build robust and scalable solutions while ment…",Mutual Funds Asset Management,"San Francisco, California",https://www.adzuna.com/land/ad/4911338712?se=qubCTrSj7xGfqSPcuaEk9w&utm_medium=api&utm_source=4772744a&v=F98B8DDAEBB986A8810B1CED8FDD0ECE984FA6AB,127903.98,127903.98
REMOTE - Sr Software Developer (Python),"Job Description candidate must be local to PST or MST time zones Must work PST hours, no flexibility The Auth and Policy Platform team provides a source of truth for infrastructure workload identity, access, and metadata for the developer platform used by this part of the organization. This team provides fundamental metadata and access controls that allow the developer platform to update in a true self-service fashion, while satisfying necessary security and policy controls. This team has a new…",Insight Global,"Santa Monica, Los Angeles County",https://www.adzuna.com/details/4914228943?utm_medium=api&utm_source=4772744a,77364.61,77364.61
Sr. Application Developer – Python & SQL,"Company Federal Reserve Bank of San Francisco We are the Federal Reserve Bank of San Francisco—public servants with a mission to advance the nation’s monetary, financial, and payment systems to build a stronger economy for all Americans. We are a community-engaged bank, and are committed to understanding and serving the vibrant, expansive communities of the Twelfth District. We respect people for what they do and for who they are. We build opportunities to learn and grow. We empower our people …",Federal Reserve Bank of San Francisco,"San Francisco, California",https://www.adzuna.com/details/4845939539?utm_medium=api&utm_source=4772744a,162704.67,162704.67
Sr. Application Developer - Python & SQL,"Company Federal Reserve Bank of San Francisco We are the Federal Reserve Bank of San Francisco-public servants with a mission to advance the nation's monetary, financial, and payment systems to build a stronger economy for all Americans. We are a community-engaged bank, and are committed to understanding and serving the vibrant, expansive communities of the Twelfth District. We respect people for what they do and for who they are. We build opportunities to learn and grow. We empower our people …",Federal Reserve Bank,"SoMa, San Francisco",https://www.adzuna.com/details/4841491036?utm_medium=api&utm_source=4772744a,174028.88,174028.88
"Python Full Stack Developer at San Ramon, CA","Python Full Stack Developer Work Location: San Ramon, CA (Needed only Locals 30-40 miles) Work Mode : Day 1 onsite. Mode of Interview: F2F only Required Skills: Hands-on & In depth knowledge of Python application programming concepts, Django REST framework, Flask Create services as part of back-end: message intake and processing pipelines (message flow), REST APIs for front-end, data manipulation (JSON,XML, flat), external services calling. Including Pandas, Pytest, Exception handling, Multithr…",Marvel Infotech,"San Ramon, Contra Costa County",https://www.adzuna.com/details/4939478632?utm_medium=api&utm_source=4772744a,115200.0,N/A
Full Stack Developer (React  Python),"Hello People, Job Title: Full Stack Developer (React  Python) Location: Charlotte NC/Concord CA Responsibilities: We are seeking a Full Stack Developer with expertise in front-end and back-end development. The ideal candidate will have experience in creating dynamic, responsive web applications using React, TypeScript, and Python, with FastAPI for API development, and a strong understanding of MongoDB. Essential Technical Skills: Proficiency in ReactJS for front-end development, creating dynami…",Cays Inc,"Pacheco, Contra Costa County",https://www.adzuna.com/details/4917054723?utm_medium=api&utm_source=4772744a,96000.0,N/A
Senior Software Engineer - Python/MongoDB,"Job Description Job Description We're enabling high-performing, rock-solid MongoDB deployments on any cloud or platform our customers choose. We want to create the world's best open source analog to MongoDB Altas or Amazon DocumentDB, which can be owned, controlled and operated by end-users on their own multi-cloud or on-premise environments. Canonical is looking for an experienced Python developer with a background in MongoDB who will help us to build a fully managed MongoDB solution based on …",Canonical - Jobs,"San Jose, Santa Clara County",https://www.adzuna.com/land/ad/4922063979?se=qubCTrSj7xGfqSPcuaEk9w&utm_medium=api&utm_source=4772744a&v=64C4A7EC6A23F41AAEF8E0B91A129BF301D9D52C,197934.62,197934.62
Senior Software Engineer - Python/MongoDB,"Job Description Job Description We're enabling high-performing, rock-solid MongoDB deployments on any cloud or platform our customers choose. We want to create the world's best open source analog to MongoDB Altas or Amazon DocumentDB, which can be owned, controlled and operated by end-users on their own multi-cloud or on-premise environments. Canonical is looking for an experienced Python developer with a background in MongoDB who will help us to build a fully managed MongoDB solution based on …",Canonical - Jobs,"San Diego, San Diego County",https://www.adzuna.com/land/ad/4940353435?se=qubCTrSj7xGfqSPcuaEk9w&utm_medium=api&utm_source=4772744a&v=EEC7BD243D26550065D41C390B28B66608C90DCD,186353.16,186353.16
Senior Software Engineer - Python/MongoDB,"Job Description Job Description We're enabling high-performing, rock-solid MongoDB deployments on any cloud or platform our customers choose. We want to create the world's best open source analog to MongoDB Altas or Amazon DocumentDB, which can be owned, controlled and operated by end-users on their own multi-cloud or on-premise environments. Canonical is looking for an experienced Python developer with a background in MongoDB who will help us to build a fully managed MongoDB solution based on …",Canonical - Jobs,"Los Angeles, Los Angeles County",https://www.adzuna.com/land/ad/4940363463?se=qubCTrSj7xGfqSPcuaEk9w&utm_medium=api&utm_source=4772744a&v=503CDBDB73614957013DE1E4CEE988A24B8ADED6,195199.98,195199.98
Senior Software Engineer - Python/MongoDB,"Job Description Job Description We're enabling high-performing, rock-solid MongoDB deployments on any cloud or platform our customers choose. We want to create the world's best open source analog to MongoDB Altas or Amazon DocumentDB, which can be owned, controlled and operated by end-users on their own multi-cloud or on-premise environments. Canonical is looking for an experienced Python developer with a background in MongoDB who will help us to build a fully managed MongoDB solution based on …",Canonical - Jobs,"San Bernardino, San Bernardino County",https://www.adzuna.com/land/ad/4940361981?se=qubCTrSj7xGfqSPcuaEk9w&utm_medium=api&utm_source=4772744a&v=5C4C79AB4497A709B0F6B5E7F93974EB9D0D8C2B,180935.86,180935.86
Senior Software Engineer - Python/MongoDB,"Job Description Job Description We're enabling high-performing, rock-solid MongoDB deployments on any cloud or platform our customers choose. We want to create the world's best open source analog to MongoDB Altas or Amazon DocumentDB, which can be owned, controlled and operated by end-users on their own multi-cloud or on-premise environments. Canonical is looking for an experienced Python developer with a background in MongoDB who will help us to build a fully managed MongoDB solution based on …",Canonical - Jobs,"Fresno, Fresno County",https://www.adzuna.com/land/ad/4940362876?se=nPIPT7Sj7xG65D1_wqcsRg&utm_medium=api&utm_source=4772744a&v=BBB2051F478933E7888D410127FE6F09CF2D17D6,189938.97,189938.97
Senior Software Engineer - Python/MongoDB,"Job Description Job Description We're enabling high-performing, rock-solid MongoDB deployments on any cloud or platform our customers choose. We want to create the world's best open source analog to MongoDB Altas or Amazon DocumentDB, which can be owned, controlled and operated by end-users on their own multi-cloud or on-premise environments. Canonical is looking for an experienced Python developer with a background in MongoDB who will help us to build a fully managed MongoDB solution based on …",Canonical - Jobs,"Sacramento, Sacramento County",https://www.adzuna.com/land/ad/4919886261?se=nPIPT7Sj7xG65D1_wqcsRg&utm_medium=api&utm_source=4772744a&v=715FCC8D1C7C6F0F2F0F2083ABA8D4839ACDA74A,199219.17,199219.17
Backend Engineer (SF Bay Area),"Job Description Job Description Who are we? Ema is building the next generation AI technology to empower every employee in the enterprise to be their most creative and productive. Our proprietary tech allows enterprises to delegate most repetitive tasks to Ema, the Universal AI employee. We are founded by ex-Google, Coinbase, Okta executives, and serial entrepreneurs. We’re well-funded by the top investors and angels in the world. Ema is based in Silicon Valley and Bangalore. This will be a hyb…",Ema,"Bodega Bay, Sonoma County",https://www.adzuna.com/land/ad/4909091723?se=nPIPT7Sj7xG65D1_wqcsRg&utm_medium=api&utm_source=4772744a&v=E8643ED874FE81015F928D44D08A48F1A9F0BBD6,141250.17,141250.17
"Director, Software - CUDA Python","NVIDIA CUDA team is looking for an outstanding leader to head the CUDA Python charter. This essential role provides a rare opportunity to influence and deliver a wide range of CUDA Python releases collaborating with Python community. We are looking to grow our company with the most inquisitive people in the world and put your passion to work This role will work with engineers, product managers, and program leaders to build and implement a comprehensive plan for CUDA Python software. Our directo…",NVIDIA,"Holy, Santa Clara County",https://www.adzuna.com/details/4940621442?utm_medium=api&utm_source=4772744a,323854.72,323854.72
Entry Level Machine Learning Engineer (Remote),"SynergisticIT is committed to fast-tracking your career by increasing your career prospects. We provide a broad spectrum of career advancement solutions. Whether you are struggling to find a job or hustling to get noticed by hiring managers, we can help you stand out in your professional endeavors. Trusted by thousands of tech enthusiasts, SynergisticIT can bridge your skill and knowledge gap to make you competent for high-tech jobs. Our invaluable business acumen helps us assist thriving job s…",SynergisticIT,"Hayes Valley, San Francisco",https://www.adzuna.com/details/4928758288?utm_medium=api&utm_source=4772744a,73791.98,73791.98
CUDA Python Technical Product Manager,"Are you passionate about using Python to bring to bear high-performance computing? Do you want to help Python developers unlock the full potential of GPUs on the CUDA platform? As the demand for GPU-accelerated applications grows across industries like AI, scientific computing, and data analysis, Python developers increasingly seek a more native, detailed experience with CUDA. We are looking for a Technical Product Manager who can drive the vision, strategy, and product roadmap to bring Python …",NVIDIA,"Holy, Santa Clara County",https://www.adzuna.com/details/4915984742?utm_medium=api&utm_source=4772744a,208100.25,208100.25
Python Engineer (SAAS - Product Development) - On-Site - San Francisco,"PLEASE READ: This job posting is posted by a 3rd party recruiter filling this position on behalf of the client. This position is an on-site position in the San Francisco Bay area and remote candidates will not be considered. Job Description The client is a San Francisco-based social media company looking to revolutionize how we communicate with each other. They are constantly building, launching, and iterating. They believe that the best consumer products are built by small teams with low egos.…",Hippogriff Consulting,"California, US",https://www.adzuna.com/details/4937075945?utm_medium=api&utm_source=4772744a,144639.27,144639.27
Embedded Network Engineer,"Job Description Job Description We are offering an opportunity for an Application Development Analyst III (Contractor) to join our team in Sunnyvale, California. As a vital part of our team, your primary focus will be on maintaining and enhancing applications for our deployed devices, including addressing bug fixes and other reported issues. You will be involved in the full systems life cycle, from design to implementation and maintenance, and will work closely with customers, business analysts…",Robert Half,"Sunnyvale, Santa Clara County",https://www.adzuna.com/land/ad/4939178626?se=nPIPT7Sj7xG65D1_wqcsRg&utm_medium=api&utm_source=4772744a&v=12F7529BA391484E628C1F1E658208832D6A99BE,124800.0,130560
"Technical Lead/Manager, Engineering","Job Description Job Description Company Description About VIVIO VIVIO Health, a Public Benefit Corporation, is revolutionizing pharmacy benefits management through data and technology. Our foundational principle - ""The Right Drug for the Right Person at the Right Price"" - drives everything we do. Since 2016, our evidence-based approach has delivered superior health outcomes while reducing costs for self-insured employers and health plans. By ensuring each patient receives the most appropriate m…",VIVIO Health,"Hayward, Alameda County",https://www.adzuna.com/land/ad/4924066618?se=nPIPT7Sj7xG65D1_wqcsRg&utm_medium=api&utm_source=4772744a&v=80C2A9AD3E2022D126B374A047D0C0C0DF3924EE,120078.38,120078.38
Test Automation Developer,"Job Description Job Description Job Title: Test Automation Developer Location: Fremont, CA (Onsite) Position Type: 12 Months Contract Mandatory: Python Minimum Qualifications: Bachelor's degree in Computer Science / Electronics Engineering 5 years work experience in one of the areas below Proactively create experiments and tooling to detect and diagnose hardware/firmware/software health issues Test Automation Developers Experience working through full life cycle of server/storage platforms Prov…",Apptad Inc,"Fremont, Alameda County",https://www.adzuna.com/land/ad/4936095400?se=nPIPT7Sj7xG65D1_wqcsRg&utm_medium=api&utm_source=4772744a&v=333EEE759505A48D8199429E912AD6D9B4119772,81872.75,81872.75
Full Stack Engineer,ReSync Bio is building the all-in-one platform for managing preclinical drug discovery. We're hiring a Full Stack Engineer to join our rockstar team. Responsibilities: Design and implement scalable backend services using Django and Python Develop and maintain AWS cloud infrastructure using Terraform Create and optimize database schemas and queries Implement RESTful APIs and integrate with frontend applications Utilize Pydantic for data validation and serialization Implement security best practi…,ReSync Bio,"San Francisco, California",https://www.adzuna.com/details/4907367218?utm_medium=api&utm_source=4772744a,131873.89,131873.89
Senior Python Web3 Engineer - Remote Globally,"Job Responsibilities: Design, develop, and maintain robust Python applications integrating Web2 and Web3 technologies Implement and maintain blockchain integrations and smart contracts Develop RESTful APIs and microservices architecture for scalable applications Ensure the seamless integration of various EVM blockchain platforms (e.g., Ethereum, and Avalanche) with our applications Architect and implement microservice-based solutions ensuring scalability, reliability, and performance Work with …",Yeah! Global,"California, US",https://www.adzuna.com/details/4939329589?utm_medium=api&utm_source=4772744a,95114.37,95114.37
HPC Product Development Engineer (Kubernetes/Shell/Python),"Base Pay Range: $91,500.00 - $155,600.00 Annually Primary Location: USA-CA-Milpitas-KLA KLA’s total rewards package for employees may also include participation in performance incentive programs and eligibility for additional benefits identified below. Interns are eligible for some of the benefits identified below. Our pay ranges are determined by role, level, and location. The range displayed above reflects the minimum and maximum pay for this position in the primary location identified in thi…",KLA,"Milpitas, Santa Clara County",https://www.adzuna.com/details/4938918600?utm_medium=api&utm_source=4772744a,84546.79,84546.79
